{
  "$schema": "https://json-schema.org/draft/2020-12/schema",
  "title": "PDF2Data configurable extraction rules",
  "type": "object",
  "required": ["schema_version", "id", "version", "fields"],
  "properties": {
    "schema_version": {"const": "pdf2data.extraction-rules.v1"},
    "id": {"type": "string", "minLength": 1},
    "version": {"type": "string", "minLength": 1},
    "description": {"type": "string"},
    "families": {"type": "array", "items": {"type": "string"}},
    "fields": {
      "type": "array", "minItems": 1, "maxItems": 200,
      "items": {
        "type": "object", "required": ["id", "type"],
        "properties": {
          "id": {"type": "string", "pattern": "^[A-Za-z][A-Za-z0-9_.-]{0,79}$"},
          "label": {"type": "string"},
          "description": {"type": "string"},
          "type": {"enum": ["text", "reference", "date", "quantity", "formula"]},
          "extractor": {"enum": ["regex", "formulas"]},
          "pattern": {"type": "string", "maxLength": 2000},
          "flags": {"type": "array", "items": {"enum": ["IGNORECASE", "MULTILINE", "DOTALL"]}},
          "pages": {"type": "array", "items": {"type": "integer", "minimum": 1}, "uniqueItems": true},
          "scope": {"enum": ["all", "body_candidate", "header_candidate", "footer_candidate"]},
          "families": {"type": "array", "items": {"type": "string"}},
          "date_format": {"type": "string"},
          "unit": {"type": "string"}
        },
        "oneOf": [
          {"required": ["extractor"], "properties": {"extractor": {"const": "formulas"}, "type": {"const": "formula"}}},
          {"required": ["pattern"], "properties": {"extractor": {"const": "regex"}}}
        ]
      }
    }
  }
}
